ID,Platform,Category,Cookie / Data Key name,Domain,Description,Retention period,Data Controller,User Privacy & GDPR Rights Portals
256cc3f6-d881-11e9-8a34-2a2ae2dbcce4,Bing / Microsoft,Functional,x-ms-gateway-slice,microsoft.com (3rd party),Identifies a gateway for load balancing.,End of session (browser),Microsoft,https://account.microsoft.com/privacy
256cc540-d881-11e9-8a34-2a2ae2dbcce4,Bing / Microsoft,Marketing,ToptOut,.bing.com (3rd party) or .microsoft.com (3rd party),Records your decision not to receive interest-based advertising delivered by Microsoft.,1 year,Microsoft,https://account.microsoft.com/privacy
256cc676-d881-11e9-8a34-2a2ae2dbcce4,Bing / Microsoft,Marketing,ACH01,.bing.com (3rd party) or .microsoft.com (3rd party),Maintains information about which ad and where the user clicked on the ad.,End of session (browser),Microsoft,https://account.microsoft.com/privacy
256cc7a2-d881-11e9-8a34-2a2ae2dbcce4,Twitter,Marketing,Guest_id,twitter.com (3rd party),This cookie is set by Twitter to identify and track the website visitor. Registers if a users is signed in the Twitter platform and collects information about ad preferences. ,2 years,Twitter,https://help.twitter.com/nl/safety-and-security#ads-and-data-privacy
256cc8d8-d881-11e9-8a34-2a2ae2dbcce4,Twitter,Marketing,personalization_id,twitter.com (3rd party),"Unique value with which users can be identified by Twitter. Collected information is used to be personalize Twitter services, including Twitter trends, stories, ads and suggestions.",2 years,Twitter,https://help.twitter.com/nl/safety-and-security#ads-and-data-privacy
256cca18-d881-11e9-8a34-2a2ae2dbcce4,MOAT,Analytics,N/A,moatads.com (3rd party),Javascript tag used to measure and monitor ad visibilty/viewability and brand safety standards.,N/A,Oracle,https://www.oracle.com/legal/privacy/services-privacy-policy.html
256ccd6a-d881-11e9-8a34-2a2ae2dbcce4,DMA Institute,Analytics,N/A,dmai.com (3rd party),Javascript tag used to measure and monitor ad visibilty/viewability and brand safety standards.,N/A,DMA Institute,https://www.dma-institute.com/gdpr/
256cceb4-d881-11e9-8a34-2a2ae2dbcce4,Meetrics,Analytics,N/A,meetrics.net (3rd party),Javascript tag used to measure and monitor ad visibilty/viewability and brand safety standards.,N/A,Meetrics,https://www.meetrics.com/en/data-privacy/
256ccfea-d881-11e9-8a34-2a2ae2dbcce4,Inspectlet,Analytics,__insp_pad,Inspectlet.com (3rd party),This cookie contains the page number of the session recording.,End of session (browser),Inspectlet,https://docs.inspectlet.com/hc/en-us
256cd12a-d881-11e9-8a34-2a2ae2dbcce4,Inspectlet,Analytics,__insp_sid,Inspectlet.com (3rd party),This cookie contains the ID of the Inspectlet session that is being recorded.,End of session (browser),Inspectlet,https://docs.inspectlet.com/hc/en-us
256cd3e6-d881-11e9-8a34-2a2ae2dbcce4,Inspectlet,Analytics,__insp_ref,Inspectlet.com (3rd party),The cookie contains the referrer source/URL,End of session (browser),Inspectlet,https://docs.inspectlet.com/hc/en-us
256cd53a-d881-11e9-8a34-2a2ae2dbcce4,Inspectlet,Analytics,__insp_scpt,Inspectlet.com (3rd party),This cookie contains an integer that allows us to know if the screen capture was triggered or not.,End of session (browser),Inspectlet,https://docs.inspectlet.com/hc/en-us
256cd922-d881-11e9-8a34-2a2ae2dbcce4,Inspectlet,Analytics,__insp_nv,Inspectlet.com (3rd party),This cookie contains a value that allows Inspectlet to know if this user is a new visitor or a returning visitor.,End of session (browser),Inspectlet,https://docs.inspectlet.com/hc/en-us
256cda62-d881-11e9-8a34-2a2ae2dbcce4,Inspectlet,Analytics,__insp_wid,Inspectlet.com (3rd party),This cookie contains an uniqe user ID provided by the website if set up.,End of session (browser),Inspectlet,https://docs.inspectlet.com/hc/en-us
256cdba2-d881-11e9-8a34-2a2ae2dbcce4,Inspectlet,Analytics,__insp_uid,Inspectlet.com (3rd party),This cookie contains random ID assigned to a visitor.,1 year,Inspectlet,https://docs.inspectlet.com/hc/en-us
256cdcd8-d881-11e9-8a34-2a2ae2dbcce4,Indeed,Analytics,CTK,conv.indeed.com (3rd party),Contains information related to registering (counting) a job application via a job listing on indeed.com.,17 years,Indeed,https://www.indeed.nl/legal
256cde18-d881-11e9-8a34-2a2ae2dbcce4,Indeed,Analytics,ctkgen,conv.indeed.com (3rd party),Contains information related to registering (counting) a job application via a job listing on indeed.com.,1 day,Indeed,https://www.indeed.nl/legal
256cdf44-d881-11e9-8a34-2a2ae2dbcce4,Indeed,Analytics,INDEED_CSRF_TOKEN,conv.indeed.com (3rd party),Contains information related to registering (counting) a job application via a job listing on indeed.com.,End of session (browser),Indeed,https://www.indeed.nl/legal
256ce30e-d881-11e9-8a34-2a2ae2dbcce4,Indeed,Analytics,jasx_pool_id,conv.indeed.com (3rd party),Contains information related to registering (counting) a job application via a job listing on indeed.com.,End of session (browser),Indeed,https://www.indeed.nl/legal
256ce46c-d881-11e9-8a34-2a2ae2dbcce4,Indeed,Analytics,pagead/conv/%INTEGER%,conv.indeed.com (3rd party),Contains information related to registering (counting) a job application via a job listing on indeed.com.,End of session (browser),Indeed,https://www.indeed.nl/legal
06dcc491-d34b-456f-ae56-f683284f5dbd,Abovo Media,Analytics,tv_spot_tracker,Advertiser's website domain (1st party),Contains information about the timeslot of a running TV ad,End of session (browser),Abovo Media,https://www.abovomedia.nl/cookies/
cf563c2f-115b-43c1-82cd-93030ef4fe6c,Abovo Media,Analytics,abovo-cookie-consent,Advertiser's website domain (1st party),Registers cookie preferences of a user,1 year,Abovo Media,https://www.abovomedia.nl/cookies/
4c1be785-76a1-4272-b890-155b3c2e130c,Youtube,Marketing,GPS,youtube.com (3rd party),Registers a unique ID on mobile devices to enable tracking based on geographical GPS location.,1 day,Google,https://privacy.google.com/take-control.html
87613af8-8486-47ef-93c9-b45c9c285106 ,Youtube,Marketing,VISITOR_INFO1_LIVE,youtube.com (3rd party),Tries to estimate the users' bandwidth on pages with integrated YouTube videos.,179 days,Google,https://privacy.google.com/take-control.html
a578ee93-0514-4c0c-a51a-32177058f5f5,Admatic,Marketing,__adm_ui,admatic.com.tr (3rd party),"Used to track visitors on multiple websites, in order to present relevant advertisement based on the visitor's preferences.",1 year,Admatic,http://www.admatic.com.tr/en/privacy-policy.html
b9b6969a-e377-4930-bbf2-cc392ed0bbe0,Admatic,Marketing,__adm_uiex,admatic.com.tr (3rd party),"Used to track visitors on multiple websites, in order to present relevant advertisement based on the visitor's preferences.",1 year,Admatic,http://www.admatic.com.tr/en/privacy-policy.html
964f057a-34ae-4352-831a-b413901c1511,Admatic,Marketing,__adm_usyncc,admatic.com.tr (3rd party),"Used to identify the visitor across visits and devices. This allows the website to present the visitor with relevant advertisement - The service is provided by third party advertisement hubs, which facilitate real-time bidding for advertisers.",5 days,Admatic,http://www.admatic.com.tr/en/privacy-policy.html
0083f4a3-159a-4ed8-80d0-0d26ec97b778,Cloudflare,Functional,__cfduid,Advertiser's website domain (1st party),"The '__cfduid' cookie is set by the CloudFlare service to identify trusted web traffic. It does not correspond to any user id in the web application, nor does the cookie store any personally identifiable",5 years,Cloudflare,https://www.cloudflare.com/privacypolicy/
717b8c97-4205-4c1e-960b-0e6c1267b268,Sonobi,Marketing,__uin_bw,.go.sonobi.com (3rd party),"Collects information on visitor behaviour on multiple websites. This information is used on the website, in order to optimize the relevance of advertisement.",1 month,Sonobi,https://sonobi.com/privacy-policy/
befebc70-9497-4f2c-be86-b76ef2a2d3f4,Sonobi,Marketing,__uir_bw,.go.sonobi.com (3rd party),"Collects data on visitors' behaviour and interaction - This is used to optimize the website and make advertisement on the website more relevant.",1 day,Sonobi,https://sonobi.com/privacy-policy/
b1ece5c5-f6b1-4109-8437-da5e522f1c2d,Sonobi,Marketing,__uis,.go.sonobi.com (3rd party),"Used to track visitors on multiple websites, in order to present relevant advertisement based on the visitor's preferences.",29 days,Sonobi,https://sonobi.com/privacy-policy/
4da9f26a-7deb-4dfb-9294-1d50cfac1fdc,Pulsepoint,Marketing,contextweb.com (3rd party),"Collects information on user preferences and/or interaction with web-campaign content - This is used on CRM-campaign-platform used by website owners for promoting events or products.",Session,Pulsepoint,http://pulsepoints-new-website.webflow.io/privacy-policy/platform#consumer-choice
